[
  {
    "hsCode": "8208.30",
    "destinationCountry": "European Union",
    "mfnRate": "1.70%",
    "preferentialRate": "0%",
    "agreement": "EU-Canada CETA tariff preference",
    "eligibilityNotes": [
      "Normalized from the European Commission Access2Markets tariff endpoint for HS 820830, origin Canada, destination Germany, retrieved 2026-03-13.",
      "Germany is used as the representative EU member-state destination because the official endpoint requires a member-state code even though customs duties are part of the EU common customs tariff.",
      "MFN basis is the ERGA OMNES third-country duty shown as 1.70%; the Canada tariff preference shown in the same snapshot is 0% from 2017-09-21."
    ],
    "source": "European Commission Access2Markets tariff endpoint (CA -> DE snapshot)",
    "effectiveDate": "2026-03-13"
  },
  {
    "hsCode": "0901.21",
    "destinationCountry": "European Union",
    "mfnRate": "7.50%",
    "preferentialRate": "0%",
    "agreement": "EU-Canada CETA tariff preference",
    "eligibilityNotes": [
      "Normalized from the European Commission Access2Markets tariff endpoint for HS 090121, origin Canada, destination Germany, retrieved 2026-03-13.",
      "Germany is used as the representative EU member-state destination because the official endpoint requires a member-state code even though customs duties are part of the EU common customs tariff.",
      "MFN basis is the ERGA OMNES third-country duty shown as 7.50%; the Canada tariff preference shown in the same snapshot is 0% from 2017-09-21.",
      "The same source snapshot lists an additional-duty measure tied to exports from the Russian Federation or Belarus; that contingent measure is not used as the base EU tariff rate in this normalized record."
    ],
    "source": "European Commission Access2Markets tariff endpoint (CA -> DE snapshot)",
    "effectiveDate": "2026-03-13"
  },
  {
    "hsCode": "6109.10",
    "destinationCountry": "European Union",
    "mfnRate": "12.00%",
    "preferentialRate": "0%",
    "agreement": "EU-Canada CETA tariff preference",
    "eligibilityNotes": [
      "Normalized from the European Commission Access2Markets tariff endpoint for HS 610910, origin Canada, destination Germany, retrieved 2026-03-13.",
      "Germany is used as the representative EU member-state destination because the official endpoint requires a member-state code even though customs duties are part of the EU common customs tariff.",
      "The source returns both 'T-shirts' and 'Other' product branches, but both branches show the same 12.00% ERGA OMNES duty and 0% Canada tariff preference, so the prototype normalizes the shared result at HS 6109.10.",
      "The same snapshot also shows a 2026 Canada preferential tariff quota path at 0% with an Annex 5-A commercial-document reference requirement."
    ],
    "source": "European Commission Access2Markets tariff endpoint (CA -> DE snapshot)",
    "effectiveDate": "2026-03-13"
  },
  {
    "hsCode": "9403.60",
    "destinationCountry": "European Union",
    "mfnRate": "0%",
    "preferentialRate": "0%",
    "agreement": "EU common customs tariff MFN already zero for the normalized base duty outcome",
    "eligibilityNotes": [
      "Normalized from the European Commission Access2Markets tariff endpoint for HS 940360, origin Canada, destination Germany, retrieved 2026-03-13.",
      "Germany is used as the representative EU member-state destination because the official endpoint requires a member-state code even though customs duties are part of the EU common customs tariff.",
      "The source returns dining-room/living-room furniture, shop furniture, and other wooden furniture branches, and all three branches show the same 0% ERGA OMNES third-country duty.",
      "The same snapshot also includes end-use, airworthiness, and CITES control measures, but those conditional measures are not used as the base tariff rate in this normalized record."
    ],
    "source": "European Commission Access2Markets tariff endpoint (CA -> DE snapshot)",
    "effectiveDate": "2026-03-13"
  },
  {
    "hsCode": "3923.21",
    "destinationCountry": "European Union",
    "mfnRate": "6.50%",
    "preferentialRate": "0%",
    "agreement": "EU-Canada CETA tariff preference",
    "eligibilityNotes": [
      "Normalized from the European Commission Access2Markets tariff endpoint for HS 392321, origin Canada, destination Germany, retrieved 2026-03-13.",
      "Germany is used as the representative EU member-state destination because the official endpoint requires a member-state code even though customs duties are part of the EU common customs tariff.",
      "The source returns a single branch for sacks and bags of polymers of ethylene, with a 6.50% ERGA OMNES third-country duty and a 0% Canada tariff preference.",
      "The same snapshot also includes conditional ship-platform and airworthiness suspension measures, but those conditional measures are not used as the base tariff rate in this normalized record."
    ],
    "source": "European Commission Access2Markets tariff endpoint (CA -> DE snapshot)",
    "effectiveDate": "2026-03-13"
  },
  {
    "hsCode": "9403.30",
    "destinationCountry": "European Union",
    "mfnRate": "0%",
    "preferentialRate": "0%",
    "agreement": "EU common customs tariff MFN already zero for the normalized base duty outcome",
    "eligibilityNotes": [
      "Normalized from the European Commission Access2Markets tariff endpoint for HS 940330, origin Canada, destination Germany, retrieved 2026-03-13.",
      "Germany is used as the representative EU member-state destination because the official endpoint requires a member-state code even though customs duties are part of the EU common customs tariff.",
      "The source returns desks, cupboards with doors or flaps, filing and card-index cabinets, and other wooden office furniture branches, and all returned branches show the same 0% ERGA OMNES third-country duty.",
      "The same snapshot also includes end-use, airworthiness, and CITES control measures, but those auxiliary measures are not used as the base tariff rate in this normalized record."
    ],
    "source": "European Commission Access2Markets tariff endpoint (CA -> DE snapshot)",
    "effectiveDate": "2026-03-13"
  }
]
